Stock Name,Stock Ticker,Category,Stock Explain,Resources
3M,MMM,Industrials,"The 3M Company is an American multinational conglomerate corporation operating in the fields of industry, worker safety, US health care, and consumer goods. The company produces over 60,000 products under several brands, including adhesives, abrasives, laminates, passive fire protection, personal protective equipment, window films, paint protection films, dental and orthodontic products, electrical and electronic connecting and insulating materials, medical products, car-care products, electronic circuits, healthcare software and optical films. It is based in Maplewood, a suburb of Saint Paul, Minnesota.",https://www.3m.com/
A. O. Smith,AOS,Industrials,A. O. Smith Corporation is an American manufacturer of both residential and commercial water heaters and boilers and the largest manufacturer and marketer of water heaters in North America. It also supplies water treatment products in the Asian market.,http://www.aosmith.com
Abbott Laboratories,ABT,Health Care,"Abbott Laboratories is an American multinational medical devices and health care company with headquarters in Abbott Park, Illinois, United States. The company was founded by Chicago physician Wallace Calvin Abbott in 1888 to formulate known drugs; today, it sells medical devices, diagnostics, branded generic medicines and nutritional products. It split off its research-based pharmaceuticals business into AbbVie in 2013.",http://www.abbott.com
AbbVie,ABBV,Health Care,AbbVie is an American publicly traded biopharmaceutical company founded in 2013. It originated as a spin-off of Abbott Laboratories.,http://www.abbvie.com
Accenture,ACN,Information Technology,"Accenture plc is an Irish-domiciled multinational company that provides consulting and processing services. It has been incorporated in Dublin, Ireland since 2009.",http://www.accenture.com
Adobe Inc.,ADBE,Information Technology,"Adobe Inc. is an American multinational computer software company. Incorporated in Delaware and headquartered in San Jose, California, it has historically specialized in software for the creation and publication of a wide range of content, including graphics, photography, illustration, animation, multimedia, motion pictures and print. The company has expanded into digital marketing management software. Adobe has millions of users worldwide. Flagship products include: Photoshop image editing software, Adobe Illustrator vector-based illustration software, Adobe Acrobat Reader and the Portable Document Format (PDF), plus a host of tools primarily for audio-visual content creation, editing and publishing.",http://www.adobe.com
Advanced Micro Devices,AMD,Information Technology,"Advanced Micro Devices, Inc. (AMD) is an American multinational semiconductor company based in Santa Clara, California, that develops computer processors and related technologies for business and consumer markets. AMD's main products include microprocessors, motherboard chipsets, embedded processors and graphics processors for servers, workstations, personal computers and embedded system applications.",http://www.amd.com
AES Corporation,AES,Utilities,"The AES Corporation is a Fortune 500 company that generates and distributes electrical power. AES is headquartered in Arlington, Virginia.",http://www.aes.com
Aflac,AFL,Financials,Aflac Inc. (American Family Life Assurance Company) is an American insurance company and is the largest provider of supplemental insurance in the United States.,http://www.aflac.com
Agilent Technologies,A,Health Care,"Agilent Technologies, Inc. is an American analytical instrumentation development and manufacturing company that offers its products and services to markets worldwide. Its global headquarters is located in Santa Clara, California.",http://www.agilent.com
Air Products,APD,Materials,"Air Products and Chemicals, Inc. is an American international corporation whose principal business is selling gases and chemicals for industrial uses. Air Products' headquarters is in Allentown, Pennsylvania.",http://www.airproducts.com
Airbnb,ABNB,Consumer Discretionary,"Airbnb, Inc. is an American company that operates an online marketplace for lodging, primarily homestays for vacation rentals, and tourism activities, based in San Francisco, California.",http://www.airbnb.com
Akamai Technologies,AKAM,Information Technology,"Akamai Technologies, Inc. is a global content delivery network (CDN), cybersecurity, and cloud service company, providing web and Internet security services.",http://www.akamai.com
Albemarle Corporation,ALB,Materials,"Albemarle Corporation is a fine chemical manufacturing company based in Charlotte, North Carolina.",http://www.albemarle.com
Alexandria Real Estate Equities,ARE,Real Estate,"Alexandria Real Estate Equities, Inc. is an American real estate investment trust that invests in office buildings and laboratories leased to tenants in the life science and technology industries.",http://www.are.com
Align Technology,ALGN,Health Care,"Align Technology is a manufacturer of 3D digital scanners and the Invisalign clear aligners used in orthodontics. It is headquartered in San Jose, California.",http://www.aligntech.com
Allegion,ALLE,Industrials,"Allegion plc is an American-Irish provider based in Dublin of security products, for homes and businesses. It comprises thirty one global brands, including CISA, Interflex, LCN, Schlage and Von Duprin.",http://www.allegion.com
Alliant Energy,LNT,Utilities,"Alliant Energy is a public utility holding company headquartered in Madison, Wisconsin providing power in Iowa and Wisconsin.",http://www.alliantenergy.com
Allstate,ALL,Financials,"The Allstate Corporation is an American insurance company, headquartered in Northfield Township, Illinois.",http://www.allstate.com
Alphabet Inc. (Class A),GOOGL,Communication Services,"Alphabet Inc. is an American multinational conglomerate headquartered in Mountain View, California. It was created through a restructuring of Google on October 2, 2015, and became the parent company of Google and several former Google subsidiaries. The two co-founders of Google remained as controlling shareholders, board members, and employees at Alphabet. Alphabet is the world's fourth-largest technology company by revenue and one of the world's most valuable companies.",http://www.abc.xyz
Alphabet Inc. (Class C),GOOG,Communication Services,"Alphabet Inc. is an American multinational conglomerate headquartered in Mountain View, California. It was created through a restructuring of Google on October 2, 2015, and became the parent company of Google and several former Google subsidiaries. The two co-founders of Google remained as controlling shareholders, board members, and employees at Alphabet. Alphabet is the world's fourth-largest technology company by revenue and one of the world's most valuable companies.",http://www.abc.xyz
Altria,MO,Consumer Staples,"Altria Group, Inc. (previously known as Philip Morris Companies, Inc.) is an American corporation and one of the world's largest producers and marketers of tobacco, cigarettes and related products. It operates worldwide and is headquartered in unincorporated Henrico County, Virginia, just outside the city of Richmond.",http://www.altria.com
Amazon,AMZN,Consumer Discretionary,"Amazon.com, Inc. is an American multinational technology company which focuses on e-commerce, cloud computing, digital streaming, and artificial intelligence. It is one of the Big Five companies in the U.S. information technology industry, along with Google, Apple, Microsoft, and Facebook. The company has been referred to as one of the most influential economic and cultural forces in the world, as well as the world's most valuable brand.",http://www.amazon.com
Amcor,AMCR,Materials,"Amcor plc is an Australian-American, UK-domiciled packaging company. It develops and produces flexible packaging, rigid containers, specialty cartons, closures and services for food, beverage, pharmaceutical, medical-device, home and personal-care, and other products.",http://www.amcor.com
Ameren,AEE,Utilities,"Ameren Corporation is an American power company created December 31, 1997, by the merger of St. Louis, Missouri's Union Electric Company (formerly NYSE: UEP) and the neighboring Central Illinois Public Service Company (CIPSCO Inc. holding, formerly NYSE: CIP) of Springfield, Illinois. It is now a holding company for several power companies and energy companies.",http://www.ameren.com
American Electric Power,AEP,Utilities,"American Electric Power (AEP) is a major investor-owned electric utility in the United States, delivering electricity to more than five million customers in 11 states.",http://www.aep.com
American Express,AXP,Financials,"American Express Company is a multinational financial services corporation known for its credit cards, charge cards, and travel-related services. It serves individuals and businesses, offering premium rewards and loyalty programs.",http://www.americanexpress.com
American International Group,AIG,Financials,"American International Group, Inc. (AIG) is a global insurance and financial services company providing property, casualty, life, and retirement solutions. It serves individual, corporate, and institutional clients.",http://www.aig.com
American Tower,AMT,Real Estate,"American Tower Corporation is a real estate investment trust (REIT) specializing in owning and operating wireless communication infrastructure, including cell towers and data centers. It supports global mobile connectivity and network expansion.",http://www.americantower.com
American Water Works,AWK,Utilities,"American Water Works Company, Inc. is the largest publicly traded water and wastewater utility company in the United States. It provides essential water services to residential, commercial, and industrial customers.",http://www.amwater.com
Ameriprise Financial,AMP,Financials,"Ameriprise Financial, Inc. is a diversified financial services company offering wealth management, asset management, and insurance products. It helps individuals and institutions achieve their financial goals.",http://www.ameriprise.com
Ametek,AME,Industrials,"AMETEK, Inc. is a global manufacturer of electronic instruments and electromechanical devices. Its products serve industries such as aerospace, power generation, and healthcare, focusing on precision engineering.",http://www.ametek.com
Amgen,AMGN,Health Care,"Amgen Inc. is one of the world's leading biotechnology companies, developing and manufacturing therapies for serious illnesses such as cancer, cardiovascular diseases, and autoimmune disorders. It is known for its innovation in biopharmaceuticals.",http://www.amgen.com
Amphenol,APH,Information Technology,"Amphenol Corporation is a global leader in the design and manufacture of interconnect products, including connectors, cables, and antennas. It serves diverse industries, such as automotive, aerospace, and telecommunications.",http://www.amphenol.com
Analog Devices,ADI,Information Technology,"Analog Devices, Inc. is a global leader in designing and manufacturing analog, mixed-signal, and digital signal processing (DSP) integrated circuits. Its solutions serve industries such as automotive, healthcare, and communications.",http://www.analog.com
Ansys,ANSS,Information Technology,"ANSYS, Inc. is a leading provider of engineering simulation software. Its products help engineers and designers simulate and analyze product performance, optimizing designs across industries like aerospace, automotive, and electronics.",http://www.ansys.com
Aon,AON,Financials,"Aon plc is a global professional services firm specializing in risk management, insurance brokerage, and human resources consulting. It helps clients protect assets, manage risk, and improve employee benefits.",http://www.aon.com
APA Corporation,APA,Energy,"APA Corporation, formerly Apache Corporation, is an energy company engaged in the exploration and production of oil and natural gas. It operates globally, focusing on efficient and sustainable resource extraction.",http://www.apacorp.com
Apollo Global Management,APO,Financials,"Apollo Global Management, Inc. is a leading alternative investment firm specializing in private equity, credit, and real estate. It invests in a wide range of industries to deliver long-term growth and returns.",http://www.apollo.com
Apple Inc.,AAPL,Information Technology,"Apple Inc. is a multinational technology company known for its iconic products, including the iPhone, Mac, iPad, and Apple Watch. It is a global leader in consumer electronics, software, and services like iCloud and Apple Music.",http://www.apple.com
Applied Materials,AMAT,Information Technology,"Applied Materials, Inc. is a global leader in providing equipment, services, and software for semiconductor, display, and solar manufacturing. It plays a key role in advancing technology for chips and screens.",http://www.appliedmaterials.com
Aptiv,APTV,Consumer Discretionary,"Aptiv plc is a technology company that develops advanced safety, electrification, and connectivity solutions for the automotive industry. It focuses on enabling the future of mobility, including electric and autonomous vehicles.",http://www.aptiv.com
Arch Capital Group,ACGL,Financials,"Arch Capital Group Ltd. provides insurance, reinsurance, and mortgage insurance solutions. It serves businesses and individuals with a focus on risk management and underwriting excellence.",http://www.archcapgroup.com
Archer Daniels Midland,ADM,Consumer Staples,"Archer-Daniels-Midland Company (ADM) is a global leader in agricultural processing and food ingredients. It processes crops into products like oils, sweeteners, and biofuels, supporting the global food supply chain.",http://www.adm.com
Arista Networks,ANET,Information Technology,"Arista Networks, Inc. is a leading provider of cloud networking solutions for large data centers and high-performance computing environments. It specializes in software-driven, high-speed Ethernet networking.",http://www.arista.com
Arthur J. Gallagher & Co.,AJG,Financials,"Arthur J. Gallagher & Co. is a global insurance brokerage and risk management firm. It provides insurance consulting, claims management, and employee benefits solutions to businesses and individuals.",http://www.ajg.com
Assurant,AIZ,Financials,"Assurant, Inc. is a global provider of risk management solutions, focusing on housing, lifestyle, and automotive sectors. It offers extended warranties, renters insurance, and mobile device protection plans.",http://www.assurant.com
AT&T,T,Communication Services,"AT&T Inc. is a telecommunications giant providing wireless, broadband, and digital entertainment services. It is also involved in content creation through WarnerMedia, offering streaming and media solutions.",http://www.att.com
Atmos Energy,ATO,Utilities,"Atmos Energy Corporation is one of the largest natural gas distributors in the United States, serving residential, commercial, and industrial customers. It is committed to reliable and safe energy delivery.",http://www.atmosenergy.com
Autodesk,ADSK,Information Technology,"Autodesk, Inc. is a global leader in 3D design, engineering, and entertainment software. Its products, like AutoCAD and Revit, are widely used in architecture, construction, manufacturing, and media industries.",http://www.autodesk.com
Automatic Data Processing,ADP,Industrials,"Automatic Data Processing, Inc. (ADP) is a leading provider of human resources management software and services. It offers payroll, talent management, and compliance solutions for businesses of all sizes.",http://www.adp.com
AutoZone,AZO,Consumer Discretionary,"AutoZone, Inc. is a retailer and distributor of automotive replacement parts and accessories. It serves DIY customers, professional mechanics, and commercial businesses through its extensive store network.",http://www.autozone.com
AvalonBay Communities,AVB,Real Estate,"AvalonBay Communities, Inc. is a real estate investment trust (REIT) that develops, owns, and operates luxury apartment communities in major metropolitan areas across the United States.",http://www.avalonbay.com
Avery Dennison,AVY,Materials,"Avery Dennison Corporation is a global materials science company specializing in labeling and packaging materials. It serves industries such as retail, healthcare, and logistics with innovative adhesive and labeling solutions.",http://www.averydennison.com
Axon Enterprise,AXON,Industrials,"Axon Enterprise, Inc. develops technology and products for public safety, including body-worn cameras, non-lethal weapons such as TASER devices, and digital evidence management systems through its Axon Cloud platform.",http://www.axon.com
Baker Hughes,BKR,Energy,"Baker Hughes Company is an energy technology company providing solutions for oil and gas exploration, drilling, production, and renewable energy. It focuses on improving efficiency and sustainability in the energy sector.",http://www.bakerhughes.com
Ball Corporation,BALL,Materials,"Ball Corporation is a leading manufacturer of sustainable metal packaging for beverages, food, and household products. It is also involved in aerospace, providing innovative systems and components for defense and space exploration.",http://www.ball.com
Bank of America,BAC,Financials,"Bank of America Corporation is one of the largest financial institutions in the world, offering banking, investment, and wealth management services. It serves individual consumers, small businesses, and corporations globally.",http://www.bankofamerica.com
Baxter International,BAX,Health Care,"Baxter International Inc. is a global healthcare company providing medical devices, pharmaceuticals, and biotechnology products. It specializes in therapies for chronic and acute medical conditions, including dialysis and IV systems.",http://www.baxter.com
Becton Dickinson,BDX,Health Care,"Becton, Dickinson and Company (BD) is a leading medical technology company that manufactures medical devices, laboratory equipment, and diagnostic products. It is known for its contributions to healthcare innovation.",http://www.bd.com
Berkshire Hathaway,BRK.B,Financials,"Berkshire Hathaway Inc., led by Warren Buffett, is a multinational conglomerate holding company. It owns diverse subsidiaries across industries, including insurance, energy, railroads, and consumer goods.",http://www.berkshirehathaway.com
Best Buy,BBY,Consumer Discretionary,"Best Buy Co., Inc. is a leading retailer of consumer electronics, appliances, and services in the United States. It offers products both in-store and online, focusing on customer technology needs and support.",http://www.bestbuy.com
Bio-Techne,TECH,Health Care,"Bio-Techne Corporation develops and manufactures biotechnology products and services for research and clinical applications. Its products include proteins, antibodies, and diagnostic tools for life sciences and healthcare.",http://www.bio-techne.com
Biogen,BIIB,Health Care,"Biogen Inc. is a biotechnology company focused on developing therapies for neurological diseases, including multiple sclerosis, Alzheimer's, and spinal muscular atrophy. It is a leader in neuroscience innovation.",http://www.biogen.com
BlackRock,BLK,Financials,"BlackRock, Inc. is the world's largest asset management firm, offering investment management, risk management, and advisory services to institutional and retail clients. It is well-known for its iShares ETF platform.",http://www.blackrock.com
Blackstone Inc.,BX,Financials,"Blackstone Inc. is a leading global investment firm specializing in private equity, real estate, hedge funds, and credit. It focuses on long-term value creation through alternative investment strategies.",http://www.blackstone.com
BNY Mellon,BK,Financials,"The Bank of New York Mellon Corporation (BNY Mellon) is a global leader in investment management and financial services, offering asset servicing, investment management, and wealth management services.",http://www.bnymellon.com
Boeing,BA,Industrials,"The Boeing Company is a leading aerospace and defense company that designs, manufactures, and sells airplanes, satellites, and military equipment. It also provides related services to global airlines and governments.",http://www.boeing.com
Booking Holdings,BKNG,Consumer Discretionary,"Booking Holdings Inc. operates online travel platforms such as Booking.com, Priceline, and Kayak. It provides services for lodging, flights, car rentals, and travel experiences worldwide.",http://www.bookingholdings.com
BorgWarner,BWA,Consumer Discretionary,BorgWarner Inc. is a global leader in delivering innovative and sustainable solutions for automotive powertrain systems. It focuses on electrification and efficiency in traditional and electric vehicles.,http://www.borgwarner.com
Boston Scientific,BSX,Health Care,"Boston Scientific Corporation is a global medical technology company specializing in devices for cardiology, neurology, and urology. It is known for its minimally invasive therapies and innovations in patient care.",http://www.bostonscientific.com
Bristol Myers Squibb,BMY,Health Care,"Bristol-Myers Squibb Company is a global biopharmaceutical company focused on developing therapies for cancer, cardiovascular diseases, and immune disorders. It is known for its innovative research and development pipeline.",http://www.bms.com
Broadcom,AVGO,Information Technology,"Broadcom Inc. is a leading designer, developer, and supplier of semiconductor and infrastructure software solutions. It serves industries like networking, data centers, broadband, and wireless communication.",http://www.broadcom.com
Broadridge Financial Solutions,BR,Industrials,"Broadridge Financial Solutions, Inc. provides technology and services to financial institutions, including investor communications, securities processing, and data analytics for enhanced decision-making.",http://www.broadridge.com
Brown & Brown,BRO,Financials,"Brown & Brown, Inc. is an insurance brokerage and consulting firm offering risk management and insurance solutions to individuals and businesses. It specializes in property, casualty, and employee benefits.",http://www.bbinsurance.com
Brownâ€“Forman,BF.B,Consumer Staples,"Brown-Forman Corporation is one of the largest spirits and wine companies in the world. It produces iconic brands like Jack Daniel’s, Woodford Reserve, and Finlandia Vodka.",http://www.brown-forman.com
Builders FirstSource,BLDR,Industrials,"Builders FirstSource, Inc. is a supplier of building materials, manufactured components, and construction services to professional contractors and builders, primarily in the residential market.",http://www.bldr.com
Bunge Global,BG,Consumer Staples,"Bunge Limited is a global agribusiness and food company specializing in grain trading, oilseed processing, and food production. It supports the global food supply chain with sustainable agricultural solutions.",http://www.bunge.com
"BXP, Inc.",BXP,Real Estate,"Boston Properties, Inc. is a real estate investment trust (REIT) specializing in the development, ownership, and management of premium office spaces in major metropolitan areas across the United States.",http://www.bxp.com
C.H. Robinson,CHRW,Industrials,"C.H. Robinson Worldwide, Inc. is a global logistics company providing freight transportation and supply chain solutions. It offers services in trucking, air, ocean, and intermodal shipping.",http://www.chrobinson.com
Cadence Design Systems,CDNS,Information Technology,"Cadence Design Systems, Inc. is a technology company specializing in electronic design automation (EDA) software, used for designing and verifying complex chips and electronic systems.",http://www.cadence.com
Caesars Entertainment,CZR,Consumer Discretionary,"Caesars Entertainment, Inc. is one of the world's largest gaming and hospitality companies, operating casinos, hotels, and resorts. It offers gaming, dining, entertainment, and event services.",http://www.caesars.com
Camden Property Trust,CPT,Real Estate,"Camden Property Trust is a real estate investment trust (REIT) that owns, operates, and develops residential apartment communities across the United States, focusing on high-quality housing.",http://www.camdenliving.com
Campbell Soup Company,CPB,Consumer Staples,"Campbell Soup Company is a leading manufacturer of soups, snacks, and beverages. Its iconic brands include Campbell’s, Pepperidge Farm, and V8, catering to the packaged food market worldwide.",http://www.campbellsoupcompany.com
Capital One,COF,Financials,"Capital One Financial Corporation is a leading bank and financial services company specializing in credit cards, auto loans, banking, and savings accounts. It is well-known for its innovative digital banking solutions.",http://www.capitalone.com
Cardinal Health,CAH,Health Care,"Cardinal Health, Inc. is a healthcare services and products company that distributes pharmaceuticals, medical supplies, and laboratory products. It supports hospitals, pharmacies, and healthcare providers.",http://www.cardinalhealth.com
CarMax,KMX,Consumer Discretionary,"CarMax, Inc. is the largest used-car retailer in the United States, offering a transparent car-buying experience. It also provides financing and vehicle trade-in services.",http://www.carmax.com
Carnival,CCL,Consumer Discretionary,"Carnival Corporation & plc is the world's largest cruise line operator, offering travel experiences across various global brands such as Carnival Cruise Line, Princess Cruises, and Holland America Line.",http://www.carnivalcorp.com
Carrier Global,CARR,Industrials,"Carrier Global Corporation is a leading provider of heating, ventilation, air conditioning (HVAC), refrigeration, and fire and security solutions. It focuses on energy-efficient and sustainable building systems.",http://www.carrier.com
