Stock Name,Stock Ticker,Category,Stock Explain,Resources
Caterpillar Inc.,CAT,Industrials,"Caterpillar Inc. is the world's largest manufacturer of construction and mining equipment, diesel and natural gas engines, and industrial turbines. It serves industries like construction, mining, and energy.",http://www.caterpillar.com
Cboe Global Markets,CBOE,Financials,"Cboe Global Markets, Inc. operates one of the largest global exchanges for trading options, equities, and futures. It is known for the Volatility Index (VIX) and innovative trading products.",http://www.cboe.com
CBRE Group,CBRE,Real Estate,"CBRE Group, Inc. is the world's largest commercial real estate services and investment firm, offering property sales, leasing, facility management, and real estate consulting.",http://www.cbre.com
CDW,CDW,Information Technology,"CDW Corporation is a leading provider of technology products, services, and solutions for businesses, government agencies, and educational institutions. It offers IT hardware, software, and consulting services.",http://www.cdw.com
Celanese,CE,Materials,"Celanese Corporation is a global chemical and specialty materials company producing engineered polymers, acetyl products, and performance materials used in industrial and consumer applications.",http://www.celanese.com
Cencora,COR,Health Care,"CoreSite Realty Corporation is a real estate investment trust (REIT) specializing in data centers. It provides secure and high-performance data center solutions for enterprises, cloud providers, and network operators.",http://www.coresite.com
Centene Corporation,CNC,Health Care,"Centene Corporation is a healthcare company offering managed care services to government-sponsored healthcare programs such as Medicaid, Medicare, and the Health Insurance Marketplace.",http://www.centene.com
CenterPoint Energy,CNP,Utilities,"CenterPoint Energy, Inc. is a utility company that provides electricity and natural gas distribution services in the United States. It focuses on energy delivery and infrastructure modernization.",http://www.centerpointenergy.com
CF Industries,CF,Materials,"CF Industries Holdings, Inc. is a leading producer of nitrogen fertilizers and other agricultural chemicals. It supports the global agriculture industry with solutions for crop nutrition.",http://www.cfindustries.com
Charles River Laboratories,CRL,Health Care,"Charles River Laboratories International, Inc. provides preclinical and clinical laboratory services for pharmaceutical and biotechnology companies. It focuses on drug discovery, safety testing, and manufacturing.",http://www.criver.com
Charles Schwab Corporation,SCHW,Financials,"The Charles Schwab Corporation is a financial services firm offering brokerage, banking, and investment advisory services. It is known for its low-cost trading platforms and extensive wealth management solutions.",http://www.schwab.com
Charter Communications,CHTR,Communication Services,"Charter Communications, Inc. is a leading broadband connectivity company and cable operator in the United States. It operates under the Spectrum brand, providing internet, TV, and voice services.",http://www.charter.com
Chevron Corporation,CVX,Energy,"Chevron Corporation is a multinational energy company involved in oil and gas exploration, production, refining, and marketing. It is also investing in renewable energy and advanced energy technologies.",http://www.chevron.com
Chipotle Mexican Grill,CMG,Consumer Discretionary,"Chipotle Mexican Grill, Inc. operates fast-casual restaurants specializing in customizable burritos, tacos, and bowls. It is known for its commitment to using high-quality, responsibly sourced ingredients.",http://www.chipotle.com
Chubb Limited,CB,Financials,"Chubb Limited is one of the largest property and casualty insurance companies in the world. It provides a wide range of insurance products, including personal, commercial, and specialty coverage.",http://www.chubb.com
Church & Dwight,CHD,Consumer Staples,"Church & Dwight Co., Inc. is a consumer goods company known for its household and personal care products, including iconic brands like Arm & Hammer, Trojan, and OxiClean",http://www.churchdwight.com
Cigna,CI,Health Care,"Cigna Corporation is a global health services company offering medical, dental, and vision insurance, along with pharmacy benefit management and wellness solutions for individuals and employers.",http://www.cigna.com
Cincinnati Financial,CINF,Financials,"Cincinnati Financial Corporation provides property, casualty, and life insurance products to individuals and businesses. It focuses on reliable underwriting and claims management.",http://www.cinfin.com
Cintas,CTAS,Industrials,"Cintas Corporation provides uniforms, safety products, and facility services to businesses across various industries. It is a leader in workplace safety and hygiene solutions.",http://www.cintas.com
Cisco,CSCO,Information Technology,"Cisco Systems, Inc. is a global leader in networking hardware, software, and telecommunications equipment. It provides solutions for connectivity, security, and collaboration.",http://www.cisco.com
Citigroup,C,Financials,"Citigroup Inc. is a multinational financial services corporation providing banking, investment, and wealth management services to individuals, businesses, and governments worldwide.",http://www.citigroup.com
Citizens Financial Group,CFG,Financials,"Citizens Financial Group, Inc. is a regional bank offering retail and commercial banking services. It focuses on loans, mortgages, and wealth management solutions for individuals and businesses.",http://www.citizensbank.com
Clorox,CLX,Consumer Staples,"The Clorox Company manufactures and markets consumer products, including cleaning supplies, disinfectants, and food storage solutions. It is known for its Clorox bleach and Pine-Sol brands.",http://www.thecloroxcompany.com
CME Group,CME,Financials,"CME Group Inc. operates the world’s largest derivatives marketplace, offering trading in futures and options across asset classes such as commodities, interest rates, and foreign exchange",http://www.cmegroup.com
CMS Energy,CMS,Utilities,CMS Energy Corporation is an energy company providing electricity and natural gas to customers in Michigan. It focuses on renewable energy projects and improving energy efficiency.,http://www.cmsenergy.com
Coca-Cola Company (The),KO,Consumer Staples,"The Coca-Cola Company is a multinational beverage corporation offering iconic soft drinks, juices, and bottled water. It owns brands such as Coca-Cola, Sprite, and Minute Maid.",http://www.coca-colacompany.com
Cognizant,CTSH,Information Technology,"Cognizant Technology Solutions Corporation provides IT services, consulting, and outsourcing solutions to businesses worldwide, specializing in digital transformation and technology modernization.",http://www.cognizant.com
Colgate-Palmolive,CL,Consumer Staples,"Colgate-Palmolive Company is a global consumer goods company known for its oral care, personal care, and household products, including Colgate toothpaste and Palmolive soap.",http://www.colgatepalmolive.com
Comcast,CMCSA,Communication Services,"Comcast Corporation is a global media and technology company offering cable, internet, and streaming services through its Xfinity brand. It also owns NBCUniversal and Sky Group.",http://www.comcast.com
Conagra Brands,CAG,Consumer Staples,"Conagra Brands, Inc. is a packaged foods company offering products in categories like snacks, frozen foods, and condiments. Its brands include Healthy Choice, Hunt’s, and Orville Redenbacher's.",http://www.conagrabrands.com
ConocoPhillips,COP,Energy,"ConocoPhillips is a multinational energy company engaged in oil and natural gas exploration, production, and marketing. It focuses on sustainable energy development and resource efficiency.",http://www.conocophillips.com
Consolidated Edison,ED,Utilities,"Consolidated Edison, Inc. is a utility company providing electricity, gas, and steam to customers in New York. It focuses on renewable energy and modernizing the energy grid.",http://www.conedison.com
Constellation Brands,STZ,Consumer Staples,"Constellation Brands, Inc. is a leading producer and marketer of alcoholic beverages, including beer, wine, and spirits. Its portfolio includes brands like Corona, Modelo, and Svedka Vodka.",http://www.cbrands.com
Constellation Energy,CEG,Utilities,"Constellation Energy Corporation is an energy company providing power generation and energy solutions, focusing on nuclear, solar, and wind power to promote sustainability.",http://www.constellationenergy.com
Cooper Companies (The),COO,Health Care,"The Cooper Companies, Inc. is a global medical device company specializing in contact lenses and surgical products. Its brands include CooperVision and CooperSurgical.",http://www.coopercos.com
Copart,CPRT,Industrials,"Copart, Inc. is a global leader in online vehicle auctions, connecting buyers and sellers of used, wholesale, and salvage vehicles. Its platform serves the automotive, insurance, and dealership industries.",http://www.copart.com
Corning Inc.,GLW,Information Technology,"Corning Incorporated specializes in materials science, developing glass, ceramics, and optical components for industries such as telecommunications, life sciences, and consumer electronics.",http://www.corning.com
Corpay,CPAY,Financials,"CPI Card Group Inc. provides financial payment card solutions, including debit, credit, and prepaid cards. It also offers secure card personalization services to banks and other institutions.",http://www.cpicardgroup.com
Corteva,CTVA,Materials,"Corteva, Inc. is a global agriculture company specializing in seeds, crop protection, and digital farming solutions. It supports sustainable farming practices to improve food security.",http://www.corteva.com
CoStar Group,CSGP,Real Estate,"CoStar Group, Inc. is a leading provider of commercial real estate information, analytics, and online marketplaces. It helps businesses and investors make informed property decisions.",http://www.costar.com
Costco,COST,Consumer Staples,"Costco Wholesale Corporation is a membership-based warehouse club offering a wide variety of products at competitive prices, including groceries, electronics, and household items.",http://www.costco.com
Coterra,CTRA,Energy,Coterra Energy Inc. is an energy company engaged in oil and natural gas exploration and production. It focuses on efficient and sustainable operations in its core areas.,http://www.coterra.com
CrowdStrike,CRWD,Information Technology,"CrowdStrike Holdings, Inc. is a cybersecurity company specializing in endpoint protection and threat intelligence. Its cloud-native Falcon platform detects and prevents cyberattacks.",http://www.crowdstrike.com
Crown Castle,CCI,Real Estate,"Crown Castle Inc. is a real estate investment trust (REIT) that owns and operates cell towers, small cells, and fiber networks. It supports wireless connectivity and 5G deployment.",http://www.crowncastle.com
CSX Corporation,CSX,Industrials,CSX Corporation is a transportation company that provides rail-based freight services. It operates one of the largest railroad networks in the eastern United States.,http://www.csx.com
Cummins,CMI,Industrials,"Cummins Inc. designs, manufactures, and distributes engines, power generation products, and filtration systems. It focuses on sustainability and innovation in clean energy technologies.",http://www.cummins.com
CVS Health,CVS,Health Care,"CVS Health Corporation is a healthcare company that operates retail pharmacies, pharmacy benefit management services, and healthcare clinics under its MinuteClinic brand.",http://www.cvshealth.com
Danaher Corporation,DHR,Health Care,"Danaher Corporation is a global science and technology innovator specializing in life sciences, diagnostics, and industrial equipment. It focuses on improving healthcare and environmental solutions.",http://www.danaher.com
Darden Restaurants,DRI,Consumer Discretionary,"Darden Restaurants, Inc. operates popular restaurant chains such as Olive Garden and LongHorn Steakhouse. It focuses on providing high-quality dining experiences.",http://www.darden.com
DaVita,DVA,Health Care,"DaVita Inc. is a leading provider of kidney care services, including dialysis and related healthcare services, for patients with chronic kidney failure and end-stage renal disease.",http://www.davita.com
Dayforce,DAY,Industrials,"Dayforce HCM, Inc. provides cloud-based human capital management (HCM) solutions, including payroll, workforce management, and talent management tools for businesses.",http://www.dayforce.com
Deckers Brands,DECK,Consumer Discretionary,"Deckers Outdoor Corporation designs and markets footwear and apparel under brands like UGG, Teva, and HOKA. It focuses on premium comfort and performance products.",http://www.deckers.com
Deere & Company,DE,Industrials,"Deere & Company, commonly known as John Deere, is a global leader in manufacturing agricultural, construction, and forestry equipment. It also offers precision farming technologies.",http://www.deere.com
Dell Technologies,DELL,Information Technology,"Dell Technologies Inc. is a global technology company providing computers, storage devices, and IT infrastructure solutions for businesses and individuals.",http://www.dell.com
Delta Air Lines,DAL,Industrials,"Delta Air Lines, Inc. is one of the largest airlines in the world, offering passenger and cargo transportation services. It focuses on global connectivity and customer service.",http://www.delta.com
Devon Energy,DVN,Energy,Devon Energy Corporation is an independent oil and natural gas producer focusing on efficient operations and sustainable energy production in North America.,http://www.devonenergy.com
Dexcom,DXCM,Health Care,"DexCom, Inc. is a medical device company specializing in continuous glucose monitoring (CGM) systems for diabetes management. Its products improve patient health and convenience.",http://www.dexcom.com
Diamondback Energy,FANG,Energy,"Diamondback Energy, Inc. is an independent oil and natural gas company focused on exploration and production in the Permian Basin, a leading oil-producing region in the United States.",http://www.diamondbackenergy.com
Digital Realty,DLR,Real Estate,"Digital Realty Trust, Inc. is a real estate investment trust (REIT) that owns and operates data centers worldwide, providing secure and scalable infrastructure for cloud and IT solutions.",http://www.digitalrealty.com
Discover Financial,DFS,Financials,"Discover Financial Services is a financial services company offering credit cards, personal loans, and banking products. It is known for its Discover Card and rewards programs.",http://www.discover.com
Dollar General,DG,Consumer Staples,"Dollar General Corporation operates a chain of discount stores offering household essentials, groceries, and seasonal items at competitive prices. It focuses on serving rural and underserved communities.",http://www.dollargeneral.com
Dollar Tree,DLTR,Consumer Staples,"Dollar Tree, Inc. operates discount variety stores, including Dollar Tree and Family Dollar, offering products for $1 or slightly above. It caters to value-conscious shoppers.",http://www.dollartree.com
Dominion Energy,D,Utilities,"Dominion Energy, Inc. is a utility company providing electricity and natural gas to customers in the United States. It focuses on renewable energy projects and energy efficiency.",http://www.dominionenergy.com
Domino's,DPZ,Consumer Discretionary,"Domino’s Pizza, Inc. is a global leader in pizza delivery and carryout services. It operates a franchise-based business model and is known for its focus on technology-driven customer convenience.",http://www.dominos.com
Dover Corporation,DOV,Industrials,"Dover Corporation is a diversified global manufacturer of industrial products and equipment. It serves industries such as printing, energy, refrigeration, and fluid handling.",http://www.dovercorporation.com
Dow Inc.,DOW,Materials,"Dow Inc. is a global leader in materials science, producing chemicals, plastics, and advanced materials for various industries, including packaging, construction, and electronics.",http://www.dow.com
D. R. Horton,DHI,Consumer Discretionary,"D.R. Horton, Inc. is the largest homebuilder in the United States, constructing single-family homes, townhomes, and condos. It focuses on affordability and quality.",http://www.drhorton.com
DTE Energy,DTE,Utilities,DTE Energy Company is a diversified energy company providing electricity and natural gas services in Michigan. It also invests in renewable energy projects like wind and solar.,http://www.dteenergy.com
Duke Energy,DUK,Utilities,"Duke Energy Corporation is a leading electric power holding company, serving millions of customers in the United States. It is transitioning toward renewable energy and grid modernization.",http://www.duke-energy.com
DuPont,DD,Materials,"DuPont de Nemours, Inc. is a global innovation company providing advanced materials, specialty chemicals, and solutions for industries like electronics, automotive, and healthcare.",http://www.dupont.com
Eastman Chemical Company,EMN,Materials,"Eastman Chemical Company produces specialty chemicals, plastics, and fibers for industries such as automotive, packaging, and construction. It focuses on sustainable material solutions.",http://www.eastman.com
Eaton Corporation,ETN,Industrials,"Eaton Corporation plc is a global power management company providing electrical, hydraulic, and mechanical solutions for energy-efficient and sustainable operations.",http://www.eaton.com
eBay,EBAY,Consumer Discretionary,"eBay Inc. is an online marketplace that connects buyers and sellers globally. It facilitates the exchange of goods across various categories, including electronics, fashion, and collectibles.",http://www.ebay.com
Ecolab,ECL,Materials,"Ecolab Inc. provides water, hygiene, and energy technologies and services. It helps businesses maintain clean environments and improve water and energy efficiency.",http://www.ecolab.com
Edison International,EIX,Utilities,"Edison International is a utility holding company providing electricity through its subsidiary, Southern California Edison. It focuses on renewable energy and grid reliability.",http://www.edison.com
Edwards Lifesciences,EW,Health Care,Edwards Lifesciences Corporation specializes in medical technologies for structural heart disease and critical care monitoring. It is a leader in transcatheter heart valve innovations.,http://www.edwards.com
Electronic Arts,EA,Communication Services,"Electronic Arts Inc. (EA) is a leading video game developer and publisher. It is known for popular franchises like FIFA, Madden NFL, and The Sims, focusing on interactive entertainment.",http://www.ea.com
Elevance Health,ELV,Health Care,"Elevance Health, Inc., formerly Anthem, is a health insurance company offering medical, dental, and vision plans. It supports individuals, businesses, and government programs.",http://www.elevancehealth.com
Emerson Electric,EMR,Industrials,Emerson Electric Co. is a global technology and engineering company providing automation solutions and commercial/residential products for various industries.,http://www.emerson.com
Enphase Energy,ENPH,Information Technology,"Enphase Energy, Inc. designs and manufactures microinverters for solar energy systems. It focuses on providing efficient, reliable, and scalable solar power solutions.",http://www.enphase.com
Entergy,ETR,Utilities,Entergy Corporation is a utility company providing electricity to customers in the southern United States. It is investing in renewable energy projects and nuclear power generation.,http://www.entergy.com
EOG Resources,EOG,Energy,"EOG Resources, Inc. is an independent oil and natural gas company specializing in exploration and production. It focuses on cost-efficient operations and sustainable energy development.",http://www.eogresources.com
EPAM Systems,EPAM,Information Technology,"EPAM Systems, Inc. is a global provider of digital transformation, IT consulting, and software engineering services. It helps businesses modernize their operations with innovative technology.",http://www.epam.com
EQT Corporation,EQT,Energy,EQT Corporation is the largest producer of natural gas in the United States. It focuses on sustainable and efficient natural gas exploration and production in the Appalachian Basin.,http://www.eqt.com
Equifax,EFX,Industrials,"Equifax Inc. is a global data, analytics, and technology company specializing in credit reporting and identity verification services. It helps businesses and consumers make informed decisions.",http://www.equifax.com
Equinix,EQIX,Real Estate,"Equinix, Inc. is a real estate investment trust (REIT) that operates data centers worldwide, providing interconnection and colocation services to businesses and cloud service providers.",http://www.equinix.com
Equity Residential,EQR,Real Estate,"Equity Residential is a real estate investment trust (REIT) that owns and operates residential rental properties, focusing on high-demand urban and suburban areas in the United States.",http://www.equityapartments.com
Erie Indemnity,ERIE,Financials,"Erie Indemnity Company manages operations for the Erie Insurance Group, providing property and casualty insurance products for individuals and businesses.",http://www.erieinsurance.com
Essex Property Trust,ESS,Real Estate,"Essex Property Trust, Inc. is a real estate investment trust (REIT) that develops, owns, and operates multifamily residential properties primarily in West Coast markets.",http://www.essexapartmenthomes.com
EstÃ©e Lauder Companies (The),EL,Consumer Staples,"The Estée Lauder Companies Inc. is a global leader in beauty products, offering skincare, makeup, fragrance, and hair care brands like Estée Lauder, Clinique, and MAC.",http://www.elcompanies.com
Everest Group,EG,Financials,"Evergy, Inc. provides electricity generation, transmission, and distribution services in Kansas and Missouri. It focuses on renewable energy initiatives like wind and solar.",http://www.evergy.com
Evergy,EVRG,Utilities,"Evergy, Inc. is an energy company serving customers in Kansas and Missouri. It focuses on renewable energy, including wind and solar power, and improving energy efficiency.",http://www.evergy.com
Eversource Energy,ES,Utilities,"Eversource Energy is a utility company providing electricity, natural gas, and water services in New England. It invests in renewable energy projects, such as offshore wind farms.",http://www.eversource.com
Exelon,EXC,Utilities,"Exelon Corporation is a utility company focused on power generation and energy delivery. It operates one of the largest fleets of nuclear, wind, and solar power plants in the U.S.",http://www.exeloncorp.com
Expedia Group,EXPE,Consumer Discretionary,"Expedia Group, Inc. is an online travel company providing booking services for hotels, flights, car rentals, and vacation packages through platforms like Expedia, Hotels.com, and Vrbo.",http://www.expediagroup.com
Expeditors International,EXPD,Industrials,"Expeditors International of Washington, Inc. is a global logistics company offering air and ocean freight forwarding, customs brokerage, and supply chain solutions.",http://www.expeditors.com
Extra Space Storage,EXR,Real Estate,Extra Space Storage Inc. is a real estate investment trust (REIT) specializing in self-storage facilities. It operates storage units for personal and business use across the U.S.,http://www.extraspace.com
ExxonMobil,XOM,Energy,"Exxon Mobil Corporation is one of the largest publicly traded energy companies, focusing on oil, natural gas, and chemical production. It is investing in renewable energy and carbon capture technologies.",http://www.exxonmobil.com
"F5, Inc.",FFIV,Information Technology,"F5, Inc. provides application services and security solutions to ensure the availability, performance, and security of enterprise applications in multi-cloud environments.",http://www.f5.com
FactSet,FDS,Financials,"FactSet Research Systems Inc. provides financial data and analytics to investment professionals, helping them make informed decisions across asset management, banking, and wealth management.",http://www.factset.com
Fair Isaac,FICO,Information Technology,"Fair Isaac Corporation, known as FICO, develops predictive analytics and decision management software. It is best known for its FICO credit score used in lending and credit decisions.",http://www.fico.com
Fastenal,FAST,Industrials,"Fastenal Company is a distributor of industrial and construction supplies, offering a wide range of fasteners, tools, and safety products to businesses.",http://www.fastenal.com
Federal Realty Investment Trust,FRT,Real Estate,Federal Realty Investment Trust is a real estate investment trust (REIT) specializing in owning and managing retail and mixed-use properties in high-density markets.,http://www.federalrealty.com
FedEx,FDX,Industrials,"FedEx Corporation is a global leader in logistics, offering shipping, transportation, and supply chain solutions for businesses and individuals worldwide.",http://www.fedex.com
Fidelity National Information Services,FIS,Financials,"Fidelity National Information Services, Inc. (FIS) provides technology solutions for the banking, payment, and capital markets industries, focusing on digital transformation.",http://www.fisglobal.com
Fifth Third Bancorp,FITB,Financials,"Fifth Third Bancorp is a regional bank providing personal and commercial banking services, including loans, mortgages, and investment management, in the U.S.",http://www.53.com
First Solar,FSLR,Information Technology,"First Solar, Inc. is a leading manufacturer of photovoltaic (PV) solar panels and provider of utility-scale solar energy solutions. It focuses on sustainability and energy efficiency.",http://www.firstsolar.com
