Stock Name,Stock Ticker,Category,Stock Explain,Resources
Mastercard,MA,Financials,"Mastercard Incorporated is a global payment technology company facilitating electronic payments and providing financial services, including credit, debit, and prepaid card processing.",http://www.mastercard.com
Match Group,MTCH,Communication Services,"Match Group, Inc. is a leading provider of online dating platforms, including Tinder, Match.com, and OkCupid. It connects people worldwide through technology-driven matchmaking.",http://www.mtch.com
McCormick & Company,MKC,Consumer Staples,"McCormick & Company, Incorporated is a global leader in spices, seasonings, and flavorings. It serves retail, foodservice, and industrial customers with its iconic products.",http://www.mccormick.com
McDonald's,MCD,Consumer Discretionary,"McDonald's Corporation is the world’s largest fast-food chain, serving burgers, fries, and beverages. It operates through franchisees and company-owned restaurants globally.",http://www.mcdonalds.com
McKesson Corporation,MCK,Health Care,"McKesson Corporation is a healthcare services company providing pharmaceuticals, medical supplies, and technology solutions to healthcare providers and pharmacies.",http://www.mckesson.com
Medtronic,MDT,Health Care,"Medtronic plc is a global leader in medical technology, offering devices and therapies for cardiac, diabetes, surgical, and neurological conditions.",http://www.medtronic.com
Merck & Co.,MRK,Health Care,"Merck & Co., Inc. is a pharmaceutical company developing innovative therapies and vaccines for conditions like cancer, infectious diseases, and cardiovascular disorders.",http://www.merck.com
Meta Platforms,META,Communication Services,"Meta Platforms, Inc., formerly Facebook, is a global technology company connecting people through platforms like Facebook, Instagram, WhatsApp, and its metaverse initiatives.",http://www.meta.com
MetLife,MET,Financials,"MetLife, Inc. is a global provider of insurance, annuities, and employee benefits. It focuses on life, dental, and disability insurance for individuals and businesses.",http://www.metlife.com
Mettler Toledo,MTD,Health Care,"Mettler-Toledo International Inc. is a manufacturer of precision instruments for laboratory, industrial, and retail applications, including weighing and analytical solutions.",http://www.mt.com
MGM Resorts,MGM,Consumer Discretionary,"MGM Resorts International is a global hospitality and entertainment company operating hotels, casinos, and resorts, including iconic properties in Las Vegas and Macau.",http://www.mgmresorts.com
Microchip Technology,MCHP,Information Technology,"Microchip Technology Incorporated designs and manufactures microcontrollers, analog devices, and memory products for applications in automotive, industrial, and consumer electronics.",http://www.microchip.com
Micron Technology,MU,Information Technology,"Micron Technology, Inc. is a leading producer of memory and storage solutions, including DRAM and NAND technologies, for industries like data centers, mobile, and computing.",http://www.micron.com
Microsoft,MSFT,Information Technology,"Microsoft Corporation is a global technology company offering software, hardware, and cloud services. Its products include Windows, Office, Azure, and Xbox.",http://www.microsoft.com
Mid-America Apartment Communities,MAA,Real Estate,"Mid-America Apartment Communities, Inc. is a real estate investment trust (REIT) specializing in owning and managing apartment communities in the southeastern and southwestern United States.",http://www.maac.com
Moderna,MRNA,Health Care,"Moderna, Inc. is a biotechnology company pioneering mRNA-based medicines and vaccines, including its COVID-19 vaccine, with a focus on innovative treatments.",http://www.modernatx.com
Mohawk Industries,MHK,Consumer Discretionary,"Mohawk Industries, Inc. is a global flooring manufacturer producing carpets, tiles, hardwood, and laminate flooring for residential and commercial markets.",http://www.mohawkind.com
Molina Healthcare,MOH,Health Care,"Molina Healthcare, Inc. provides managed healthcare services, including Medicaid and Medicare plans, with a focus on underserved and low-income populations.",http://www.molinahealthcare.com
Molson Coors Beverage Company,TAP,Consumer Staples,"Molson Coors Beverage Company is a multinational brewing company producing beer and beverages, including Coors Light, Miller Lite, and Blue Moon.",http://www.molsoncoors.com
Mondelez International,MDLZ,Consumer Staples,"Mondelez International, Inc. is a global snack company producing biscuits, chocolates, and beverages. Its iconic brands include Oreo, Cadbury, and Toblerone.",http://www.mondelezinternational.com
Monolithic Power Systems,MPWR,Information Technology,"Monolithic Power Systems, Inc. designs and manufactures power management solutions, including integrated circuits for industrial, automotive, and consumer electronics.",http://www.monolithicpower.com
Monster Beverage,MNST,Consumer Staples,"Monster Beverage Corporation develops and markets energy drinks and alternative beverages. Its flagship product, Monster Energy, is globally recognized.",http://www.monsterbevcorp.com
Moody's Corporation,MCO,Financials,"Moody's Corporation provides credit ratings, research, and analytics for financial markets. Its services help investors and businesses assess risk and creditworthiness.",http://www.moodys.com
Morgan Stanley,MS,Financials,"Morgan Stanley is a global financial services company providing investment banking, wealth management, and asset management services to clients worldwide.",http://www.morganstanley.com
Mosaic Company (The),MOS,Materials,"The Mosaic Company is a leading producer of phosphate and potash fertilizers, essential for agriculture and crop production globally.",http://www.mosaicco.com
Motorola Solutions,MSI,Information Technology,"Motorola Solutions, Inc. provides communication solutions, including two-way radios, public safety software, and video security systems for businesses and governments.",http://www.motorolasolutions.com
MSCI,MSCI,Financials,"MSCI Inc. is a global provider of investment decision support tools, including indices, portfolio analytics, and ESG (Environmental, Social, Governance) data.",http://www.msci.com
"Nasdaq, Inc.",NDAQ,Financials,"Nasdaq, Inc. operates a global exchange platform for trading equities, derivatives, and other financial products. It also provides financial technology and data services.",http://www.nasdaq.com
NetApp,NTAP,Information Technology,"NetApp, Inc. is a cloud data services and data management company offering solutions for hybrid and multi-cloud environments to optimize business performance.",http://www.netapp.com
Netflix,NFLX,Communication Services,"Netflix, Inc. is a global streaming platform offering movies, TV shows, and original content. It is a leader in on-demand entertainment and media distribution.",http://www.netflix.com
Newmont,NEM,Materials,"Newmont Corporation is a leading gold mining company, producing gold, silver, and other metals. It operates mines in North America, South America, and Africa.",http://www.newmont.com
News Corp (Class A),NWSA,Communication Services,"News Corporation operates as a media and publishing company, owning assets like The Wall Street Journal, HarperCollins, and Dow Jones. Class A shares carry voting rights.",http://www.newscorp.com
News Corp (Class B),NWS,Communication Services,News Corporation Class B shares represent ownership in the same company but with limited or no voting rights compared to Class A shares.,http://www.newscorp.com
NextEra Energy,NEE,Utilities,"NextEra Energy, Inc. is a leading renewable energy company specializing in wind and solar power generation, as well as natural gas and nuclear energy production.",http://www.nexteraenergy.com
"Nike, Inc.",NKE,Consumer Discretionary,"Nike, Inc. is a global leader in sportswear and athletic footwear. It designs and markets apparel, shoes, and accessories under brands like Nike,",http://www.nike.com
NiSource,NI,Utilities,NiSource Inc. is a utility company providing natural gas and electricity services to customers in the Midwest and northeastern United States.,http://www.nisource.com
Nordson Corporation,NDSN,Industrials,"Nordson Corporation designs and manufactures dispensing systems for adhesives, coatings, and sealants, serving industries like electronics, healthcare, and automotive.",http://www.nordson.com
Norfolk Southern Railway,NSC,Industrials,"Norfolk Southern Corporation is a leading transportation company specializing in rail freight services, connecting markets across the eastern United States.",http://www.nscorp.com
Northern Trust,NTRS,Financials,"Northern Trust Corporation is a financial services company providing wealth management, asset servicing, and investment solutions to institutions and individuals.",http://www.northerntrust.com
Northrop Grumman,NOC,Industrials,"Northrop Grumman Corporation is a global aerospace and defense technology company, developing advanced systems for national security, space, and defense.",http://www.northropgrumman.com
Norwegian Cruise Line Holdings,NCLH,Consumer Discretionary,"Norwegian Cruise Line Holdings Ltd. operates a fleet of cruise ships under brands like Norwegian, Oceania, and Regent. It offers luxury and premium cruising experiences.",http://www.ncl.com
NRG Energy,NRG,Utilities,"NRG Energy, Inc. is a power generation and retail electricity company, providing energy solutions with a focus on renewable energy and sustainability.",http://www.nrg.com
Nucor,NUE,Materials,"Nucor Corporation is a leading steel producer and recycler in North America, manufacturing a variety of steel products for construction, automotive, and industrial use.",http://www.nucor.com
Nvidia,NVDA,Information Technology,"NVIDIA Corporation is a global leader in graphics processing units (GPUs) and AI computing technologies, serving industries like gaming, data centers, and autonomous vehicles.",http://www.nvidia.com
"NVR, Inc.",NVR,Consumer Discretionary,"NVR, Inc. is a homebuilder operating in the United States, constructing and selling single-family homes, townhomes, and condominiums under brands like Ryan Homes and NVHomes.",http://www.nvrinc.com
NXP Semiconductors,NXPI,Information Technology,"NXP Semiconductors N.V. is a global semiconductor company providing solutions for automotive, industrial, and IoT applications. Its products include microcontrollers, sensors, and power management devices.",http://www.nxp.com
O'Reilly Auto Parts,ORLY,Consumer Discretionary,"O'Reilly Automotive, Inc. operates a chain of auto parts stores, providing replacement parts, tools, and accessories for vehicles. It serves both professional mechanics and DIY customers.",http://www.oreillyauto.com
Occidental Petroleum,OXY,Energy,"Occidental Petroleum Corporation is an energy company specializing in oil and natural gas exploration, production, and chemical manufacturing. It focuses on low-carbon technologies.",http://www.oxy.com
Old Dominion,ODFL,Industrials,"Old Dominion Freight Line, Inc. is a leading less-than-truckload (LTL) carrier providing regional, interregional, and national freight services across North America.",http://www.odfl.com
Omnicom Group,OMC,Communication Services,"Omnicom Group Inc. is a global advertising and marketing services company, offering solutions in branding, digital marketing, public relations, and media planning.",http://www.omnicomgroup.com
ON Semiconductor,ON,Information Technology,"ON Semiconductor Corporation provides energy-efficient semiconductor solutions for automotive, industrial, and IoT markets. Its products include power management and sensors.",http://www.onsemi.com
ONEOK,OKE,Energy,"ONEOK, Inc. is a midstream service provider in the natural gas industry, focusing on gathering, processing, storage, and transportation of natural gas and natural gas liquids.",http://www.oneok.com
Oracle Corporation,ORCL,Information Technology,"Oracle Corporation is a global technology company specializing in database software, cloud computing, and enterprise resource planning (ERP) solutions.",http://www.oracle.com
Otis Worldwide,OTIS,Industrials,"Otis Worldwide Corporation is a leading manufacturer and service provider for elevators, escalators, and moving walkways, serving commercial and residential buildings globally.",http://www.otis.com
Paccar,PCAR,Industrials,"PACCAR Inc. designs and manufactures heavy-duty trucks under brands like Kenworth, Peterbilt, and DAF. It also provides financial and information technology services.",http://www.paccar.com
Packaging Corporation of America,PKG,Materials,"Packaging Corporation of America produces containerboard and corrugated packaging products, serving industries like shipping, retail, and agriculture.",http://www.packagingcorp.com
Palantir Technologies,PLTR,Information Technology,"Palantir Technologies Inc. develops data analytics platforms for government and commercial sectors, focusing on security, healthcare, and financial services.",http://www.palantir.com
Palo Alto Networks,PANW,Information Technology,"Palo Alto Networks, Inc. is a leading cybersecurity company offering solutions for network security, cloud security, and endpoint protection to prevent cyberattacks.",http://www.paloaltonetworks.com
Paramount Global,PARA,Communication Services,"Paramount Global operates as a media and entertainment company with television, film, and streaming services, including CBS, Showtime, and Paramount+.",http://www.paramount.com
Parker Hannifin,PH,Industrials,"Parker-Hannifin Corporation is a global leader in motion and control technologies, providing engineering solutions for aerospace, industrial, and automotive applications.",http://www.parker.com
Paychex,PAYX,Industrials,"Paychex, Inc. provides payroll, human resource, and benefits outsourcing services for small and medium-sized businesses, streamlining workforce management.",http://www.paychex.com
Paycom,PAYC,Industrials,"Paycom Software, Inc. offers cloud-based human capital management (HCM) software, providing solutions for payroll, talent acquisition, and employee engagement.",http://www.paycom.com
PayPal,PYPL,Financials,"PayPal Holdings, Inc. is a global leader in digital payments, providing a secure platform for online transactions, money transfers, and e-commerce solutions.",http://www.paypal.com
Pentair,PNR,Industrials,"Pentair plc is a water treatment company offering solutions for water filtration, flow, and infrastructure, focusing on sustainability and water conservation.",http://www.pentair.com
PepsiCo,PEP,Consumer Staples,"PepsiCo, Inc. is a multinational food and beverage company, known for its iconic brands like Pepsi, Lay’s, Tropicana, and Quaker. It focuses on sustainability and innovation.",http://www.pepsico.com
Pfizer,PFE,Health Care,"Pfizer Inc. is a leading pharmaceutical company, developing innovative medicines and vaccines for various therapeutic areas, including its widely recognized COVID-19 vaccine.",http://www.pfizer.com
PG&E Corporation,PCG,Utilities,PG&E Corporation is a utility company providing electricity and natural gas to customers in northern and central California. It is focused on renewable energy and grid safety.,http://www.pge.com
Philip Morris International,PM,Consumer Staples,"Philip Morris International Inc. is a global tobacco company transitioning to smoke-free products like IQOS, aiming to reduce health risks associated with smoking.",http://www.pmi.com
Phillips 66,PSX,Energy,"Phillips 66 is an energy company specializing in refining, marketing, and transporting petroleum products. It also invests in renewable energy and chemical manufacturing.",http://www.phillips66.com
Pinnacle West,PNW,Utilities,"Pinnacle West Capital Corporation is a utility company providing electricity services through its subsidiary, Arizona Public Service. It focuses on renewable energy and grid reliability.",http://www.pinnaclewest.com
PNC Financial Services,PNC,Financials,"PNC Financial Services Group, Inc. is a regional bank offering retail and commercial banking services, including loans, wealth management, and investment solutions.",http://www.pnc.com
Pool Corporation,POOL,Consumer Discretionary,"Pool Corporation is a wholesale distributor of swimming pool supplies, equipment, and related outdoor products, serving residential and commercial customers.",http://www.poolcorp.com
PPG Industries,PPG,Materials,"PPG Industries, Inc. is a global manufacturer of paints, coatings, and specialty materials, serving industries like automotive, aerospace, and construction.",http://www.ppg.com
PPL Corporation,PPL,Utilities,PPL Corporation is a utility holding company providing electricity and natural gas services in the U.S. It focuses on clean energy and grid modernization.,http://www.pplweb.com
Principal Financial Group,PFG,Financials,"Principal Financial Group, Inc. provides retirement, insurance, and asset management solutions for individuals and businesses worldwide.",http://www.principal.com
Procter & Gamble,PG,Consumer Staples,"Procter & Gamble Company is a multinational consumer goods company offering a wide range of products, including cleaning, beauty, and health brands like Tide, Pampers, and Gillette.",http://www.pg.com
Progressive Corporation,PGR,Financials,"The Progressive Corporation is one of the largest providers of car insurance in the U.S., offering coverage for autos, homes, and commercial vehicles.",http://www.progressive.com
Prologis,PLD,Real Estate,"Prologis, Inc. is a real estate investment trust (REIT) specializing in logistics and industrial properties, serving e-commerce and supply chain industries globally.",http://www.prologis.com
Prudential Financial,PRU,Financials,"Prudential Financial, Inc. provides insurance, investment management, and retirement solutions to individuals and institutions worldwide.",http://www.prudential.com
Public Service Enterprise Group,PEG,Utilities,Public Service Enterprise Group (PSEG) is a utility company providing electricity and natural gas services in New Jersey. It invests in clean energy projects like solar and wind.,http://www.pseg.com
PTC Inc.,PTC,Information Technology,"PTC Inc. provides software solutions for product lifecycle management, computer-aided design (CAD), and Internet of Things (IoT), helping businesses innovate and optimize operations.",http://www.ptc.com
Public Storage,PSA,Real Estate,"Public Storage is a real estate investment trust (REIT) that owns and operates self-storage facilities, offering storage solutions for personal and business needs.",http://www.publicstorage.com
PulteGroup,PHM,Consumer Discretionary,"PulteGroup, Inc. is a leading homebuilder in the U.S., constructing single-family homes, townhomes, and apartments under brands like Pulte Homes and Del Webb.",http://www.pultegroup.com
Quanta Services,PWR,Industrials,"Quanta Services, Inc. provides specialized contracting services for the electric power, pipeline, and telecommunications industries, focusing on infrastructure development.",http://www.quantaservices.com
Qualcomm,QCOM,Information Technology,"QUALCOMM Incorporated is a global leader in wireless technology, developing semiconductors and software for mobile devices, IoT, and automotive applications.",http://www.qualcomm.com
Quest Diagnostics,DGX,Health Care,"Quest Diagnostics Incorporated is a leading provider of diagnostic testing, information, and healthcare services, offering laboratory testing for patients and healthcare providers.",http://www.questdiagnostics.com
Ralph Lauren Corporation,RL,Consumer Discretionary,"Ralph Lauren Corporation designs, markets, and distributes luxury apparel, accessories, and home products under brands like Ralph Lauren, Polo, and Chaps.",http://www.ralphlauren.com
Raymond James Financial,RJF,Financials,"Raymond James Financial, Inc. is a financial services firm offering investment banking, wealth management, and asset management services to individuals and institutions.",http://www.raymondjames.com
RTX Corporation,RTX,Industrials,"Raytheon Technologies Corporation is an aerospace and defense company specializing in advanced systems and solutions for commercial and military aircraft, as well as space systems.",http://www.rtx.com
Realty Income,O,Real Estate,"Realty Income Corporation is a real estate investment trust (REIT) focusing on commercial properties with long-term leases, providing monthly dividend income to shareholders.",http://www.realtyincome.com
Regency Centers,REG,Real Estate,Regency Centers Corporation is a real estate investment trust (REIT) owning and operating shopping centers anchored by grocery stores and retailers across the U.S.,http://www.regencycenters.com
Regeneron Pharmaceuticals,REGN,Health Care,"Regeneron Pharmaceuticals, Inc. is a biotechnology company developing innovative therapies for diseases like cancer, macular degeneration, and COVID-19.",http://www.regeneron.com
Regions Financial Corporation,RF,Financials,"Regions Financial Corporation is a regional bank providing retail and commercial banking, as well as wealth management services, primarily in the southeastern U.S.",http://www.regions.com
Republic Services,RSG,Industrials,"Republic Services, Inc. is a waste management company providing recycling and disposal services for residential, commercial, and industrial customers across the U.S.",http://www.republicservices.com
ResMed,RMD,Health Care,"ResMed Inc. is a global leader in cloud-connected devices for sleep apnea, chronic obstructive pulmonary disease (COPD), and other respiratory conditions.",http://www.resmed.com
Revvity,RVTY,Health Care,"Revvity, Inc. focuses on life sciences and diagnostics, offering solutions for drug development, environmental monitoring, and genetic screening.",http://www.revvity.com
Rockwell Automation,ROK,Industrials,"Rockwell Automation, Inc. provides industrial automation and information solutions, enabling manufacturers to optimize operations and achieve sustainability.",http://www.rockwellautomation.com
"Rollins, Inc.",ROL,Industrials,"Rollins, Inc. is a global provider of pest control services, operating under brands like Orkin and Western Pest Services, serving residential and commercial customers.",http://www.rollins.com
Roper Technologies,ROP,Information Technology,"Roper Technologies, Inc. designs and develops software and engineered products for various industries, including healthcare, transportation, and energy.",http://www.ropertech.com
Ross Stores,ROST,Consumer Discretionary,"Ross Stores, Inc. operates a chain of off-price retail stores under the Ross Dress for Less and dd’s Discounts brands, offering apparel, home goods, and accessories.",http://www.rossstores.com
Royal Caribbean Group,RCL,Consumer Discretionary,"Royal Caribbean Group operates a fleet of cruise ships under brands like Royal Caribbean International and Celebrity Cruises, providing luxury vacation experiences.",http://www.royalcaribbean.com
S&P Global,SPGI,Financials,"S&P Global Inc. provides financial information and analytics, including credit ratings, indices like the S&P 500, and market data to support investment decisions.",http://www.spglobal.com
Salesforce,CRM,Information Technology,"Salesforce, Inc. is a global leader in customer relationship management (CRM) software, providing cloud-based solutions for sales, marketing, and customer service.",http://www.salesforce.com
SBA Communications,SBAC,Real Estate,"SBA Communications Corporation is a real estate investment trust (REIT) specializing in wireless communications infrastructure, including towers and small cells.",http://www.sbasite.com
Schlumberger,SLB,Energy,"SLB is a leading oilfield services company providing technology and expertise for energy exploration, drilling, and production worldwide.",http://www.slb.com
Seagate Technology,STX,Information Technology,"Seagate Technology Holdings PLC designs and manufactures data storage solutions, including hard drives and enterprise storage systems for businesses and consumers.",http://www.seagate.com
Sempra,SRE,Utilities,"Sempra Energy is a utility holding company focusing on electricity and natural gas distribution, with a commitment to renewable energy and clean energy infrastructure.",http://www.sempra.com
ServiceNow,NOW,Information Technology,"ServiceNow, Inc. provides cloud-based digital workflow solutions, enabling businesses to automate processes and improve efficiency across IT, HR, and customer service.",http://www.servicenow.com
Sherwin-Williams,SHW,Materials,"The Sherwin-Williams Company is a global leader in paints, coatings, and related products for residential, commercial, and industrial use.",http://www.sherwin-williams.com
Simon Property Group,SPG,Real Estate,"Simon Property Group, Inc. is a real estate investment trust (REIT) owning and operating shopping malls, outlets, and retail properties globally.",http://www.simon.com
Skyworks Solutions,SWKS,Information Technology,"Skyworks Solutions, Inc. designs and manufactures semiconductors for wireless communications, powering devices in smartphones, IoT, and automotive applications.",http://www.skyworksinc.com
J.M. Smucker Company (The),SJM,Consumer Staples,"The J.M. Smucker Company produces food and beverage products, including brands like Smucker’s, Jif, and Folgers, serving consumers and foodservice markets.",http://www.jmsmucker.com
Smurfit WestRock,SW,Materials,"Stanley Black & Decker, Inc. manufactures tools, storage solutions, and security products for professional, industrial, and consumer use.",http://www.stanleyblackanddecker.com
Snap-on,SNA,Industrials,"Snap-on Incorporated designs and manufactures tools, equipment, and diagnostic products for professional mechanics and technicians in automotive and industrial sectors.",http://www.snapon.com
Solventum,SOLV,Health Care,"Solvay SA is a global chemical company providing materials and solutions for diverse industries, including aerospace, automotive, and energy.",http://www.solvay.com
